nome,preco,link,vendedor
Azeite Espanhol com Quatro Pimentas BORGES 200ml,44.99,https://www.paodeacucar.com/produto/62432/azeite-espanhol-com-quatro-pimentas-borges-200ml,Pão de Açúcar
Azeite Extra Virgem Taylors Quinta Vargella 500ml,159.9,https://www.paodeacucar.com/produto/1626304/azeite-extra-virgem-taylors-quinta-vargella-500ml,Pão de Açúcar
Azeite Extra Virgem Argentino Familia Zuccardi Picual 250ml,73.9,https://www.paodeacucar.com/produto/619859/azeite-extra-virgem-argentino-familia-zuccardi-picual-250ml,Pão de Açúcar
Condimento de Azeite de Oliva com Alecrim Borges Garrafa 200ml,44.99,https://www.paodeacucar.com/produto/133509/condimento-de-azeite-de-oliva-com-alecrim-borges-garrafa-200ml,Pão de Açúcar
Condimento de Azeite de Oliva com Casquinha de Limão Borges Garrafa 200ml,51.9,https://www.paodeacucar.com/produto/181937/condimento-de-azeite-de-oliva-com-casquinha-de-limao-borges-garrafa-200ml,Pão de Açúcar
Il Grezzo Azeite Italiano Não Filtrado Extra Virgem COSTA D'ORO 500ml,76.9,https://www.paodeacucar.com/produto/5951/il-grezzo-azeite-italiano-nao-filtrado-extra-virgem-costa-doro-500ml,Pão de Açúcar
Azeite Português de Oliva Extra Virgem ANDORINHA Vidro 500ml + Posta de Bacalhau Dessalgado Congelado RIBERALVES 800g,124.89,https://www.paodeacucar.com/produto/578523/azeite-portugues-de-oliva-extra-virgem-andorinha-vidro-500ml-+-posta-de-bacalhau-dessalgado-congelado-riberalves-800g,Pão de Açúcar
Azeite de Oliva Extra Virgem Reserva Português Gallo Vidro 500ml + Lombo de Bacalhau Dessalgado Morhua RIBERALVES 1kg,235.8,https://www.paodeacucar.com/produto/578497/azeite-de-oliva-extra-virgem-reserva-portugues-gallo-vidro-500ml-+-lombo-de-bacalhau-dessalgado-morhua-riberalves-1kg,Pão de Açúcar
Atum Sólido em Azeite de Oliva Gomes da Costa Caixa 170g,16.29,https://www.paodeacucar.com/produto/175093/atum-solido-em-azeite-de-oliva-gomes-da-costa-caixa-170g,Pão de Açúcar
Óleo Composto de Soja e Oliva Tradicional QUALITÁ 500ml,11.49,https://www.paodeacucar.com/produto/8403/oleo-composto-de-soja-e-oliva-tradicional-qualita-500ml,Pão de Açúcar
Chester Azeite e Ervas + Lasanha Bolonhesa Perdigão 600g,59.48,https://www.paodeacucar.com/produto/1538414/chester-azeite-e-ervas-+-lasanha-bolonhesa-perdigao-600g,Pão de Açúcar
Chester Azeite e Ervas + Lasanha Calabresa Perdigão 600g,59.48,https://www.paodeacucar.com/produto/1538415/chester-azeite-e-ervas-+-lasanha-calabresa-perdigao-600g,Pão de Açúcar
Óleo de Canola Tipo 1 Liza Especiais Garrafa 900ml,19.29,https://www.paodeacucar.com/produto/39657/oleo-de-canola-tipo-1-liza-especiais-garrafa-900ml,Pão de Açúcar
Sardinha Portuguesa com Azeite RAMIREZ Lata 125g,8.99,https://www.paodeacucar.com/produto/94877/sardinha-portuguesa-com-azeite-ramirez-lata-125g,Pão de Açúcar
Óleo de Girassol SALADA Pet 900ml,14.99,https://www.paodeacucar.com/produto/5148/oleo-de-girassol-salada-pet-900ml,Pão de Açúcar
Filé de Atum em Azeite de Oliva Gomes da Costa 180g,57.9,https://www.paodeacucar.com/produto/1556434/file-de-atum-em-azeite-de-oliva-gomes-da-costa-180g,Pão de Açúcar
Atum Português Sólido em Azeite RAMIREZ Lata 120g,13.49,https://www.paodeacucar.com/produto/23749/atum-portugues-solido-em-azeite-ramirez-lata-120g,Pão de Açúcar
"Chester Temperado com Azeite e Ervas Finas Congelado PERDIGÃO 4,2kg",41.58,"https://www.paodeacucar.com/produto/110706/chester-temperado-com-azeite-e-ervas-finas-congelado-perdigao-4,2kg",Pão de Açúcar
Focaccia Pedaço Azeite com Cebola 155g,7.5,https://www.paodeacucar.com/produto/1405257/focaccia-pedaco-azeite-com-cebola-155g,Pão de Açúcar
Óleo Composto de Soja e Oliva Ervas Finas Qualitá Garrafa 500ml,12.79,https://www.paodeacucar.com/produto/430149/oleo-composto-de-soja-e-oliva-ervas-finas-qualita-garrafa-500ml,Pão de Açúcar
Óleo de Canola SALADA Pet 900ml,15.99,https://www.paodeacucar.com/produto/16746/oleo-de-canola-salada-pet-900ml,Pão de Açúcar
"Compre 1 Ave Chester Azeite e Ervas Perdigão + 0,01 Leve uma Lasanha Frango com Bacon Perdigão 600g",59.48,"https://www.paodeacucar.com/produto/1538416/compre-1-ave-chester-azeite-e-ervas-perdigao-+-0,01-leve-uma-lasanha-frango-com-bacon-perdigao-600g",Pão de Açúcar
"Compre 1 Ave Chester Azeite e Ervas Perdigão + 0,01 Leve uma Lasanha Bolonhesa Perdigão 600g",59.48,"https://www.paodeacucar.com/produto/1630477/compre-1-ave-chester-azeite-e-ervas-perdigao-+-0,01-leve-uma-lasanha-bolonhesa-perdigao-600g",Pão de Açúcar
"Compre 1 Ave Chester Azeite e Ervas Perdigão + 0,01 Leve uma Lasanha Calabresa Perdigão 600g",59.48,"https://www.paodeacucar.com/produto/1630478/compre-1-ave-chester-azeite-e-ervas-perdigao-+-0,01-leve-uma-lasanha-calabresa-perdigao-600g",Pão de Açúcar
Óleo de Canola Tipo 1 Purilev Garrafa 900ml,20.49,https://www.paodeacucar.com/produto/15801/oleo-de-canola-tipo-1-purilev-garrafa-900ml,Pão de Açúcar
Manteiga de Coco Copra Vidro 200ml,29.99,https://www.paodeacucar.com/produto/711588/manteiga-de-coco-copra-vidro-200ml,Pão de Açúcar
