nome,preco,link,vendedor
Azeite Português de Oliva Extra Virgem ANDORINHA Vidro 500ml,44.99,https://www.paodeacucar.com/produto/86559/azeite-portugues-de-oliva-extra-virgem-andorinha-vidro-500ml,Pão de Açúcar
Azeite de Oliva Extravirgem O-Live 450ml,54.9,https://www.paodeacucar.com/produto/1616498/azeite-de-oliva-extravirgem-o-live-450ml,Pão de Açúcar
Azeite de Oliva Extra Virgem Clássico Espanhol Borges Vidro 500ml,42.99,https://www.paodeacucar.com/produto/55763/azeite-de-oliva-extra-virgem-classico-espanhol-borges-vidro-500ml,Pão de Açúcar
Azeite Português de Oliva Extra Virgem Ouro ANDORINHA Vidro 500ml,44.99,https://www.paodeacucar.com/produto/342248/azeite-portugues-de-oliva-extra-virgem-ouro-andorinha-vidro-500ml,Pão de Açúcar
Azeite de Oliva Extra Virgem Clássico Português Gallo Vidro 500ml,42.99,https://www.paodeacucar.com/produto/100849/azeite-de-oliva-extra-virgem-classico-portugues-gallo-vidro-500ml,Pão de Açúcar
Azeite Português de Oliva ANDORINHA Vidro 500ml,42.99,https://www.paodeacucar.com/produto/98932/azeite-portugues-de-oliva-andorinha-vidro-500ml,Pão de Açúcar
Azeite Português de Oliva Extra Virgem ANDORINHA Vidro 250ml,29.24,https://www.paodeacucar.com/produto/200486/azeite-portugues-de-oliva-extra-virgem-andorinha-vidro-250ml,Pão de Açúcar
Azeite Italiano de Oliva Extra Virgem Filippo Berio Vidro 500ml,49.99,https://www.paodeacucar.com/produto/287235/azeite-italiano-de-oliva-extra-virgem-filippo-berio-vidro-500ml,Pão de Açúcar
Azeite de Oliva Extra Virgem Clássico Português Oliveira da Serra Vidro 500ml,48.49,https://www.paodeacucar.com/produto/95910/azeite-de-oliva-extra-virgem-classico-portugues-oliveira-da-serra-vidro-500ml,Pão de Açúcar
Azeite de Oliva Tipo Único Português Gallo Vidro 500ml,46.99,https://www.paodeacucar.com/produto/145760/azeite-de-oliva-tipo-unico-portugues-gallo-vidro-500ml,Pão de Açúcar
Azeite de Oliva Extra Virgem Clássico Português Gallo Vidro 250ml,32.49,https://www.paodeacucar.com/produto/133583/azeite-de-oliva-extra-virgem-classico-portugues-gallo-vidro-250ml,Pão de Açúcar
Azeite Italiano de Oliva Extra Virgem Clássico DE CECCO Vidro 500ml,63.9,https://www.paodeacucar.com/produto/34711/azeite-italiano-de-oliva-extra-virgem-classico-de-cecco-vidro-500ml,Pão de Açúcar
Azeite de Oliva Extra Virgem Espanhol Musa Vidro 500ml,44.99,https://www.paodeacucar.com/produto/1253098/azeite-de-oliva-extra-virgem-espanhol-musa-vidro-500ml,Pão de Açúcar
Azeite Português de Oliva Extra Virgem PARUS Vidro 500ml,52.9,https://www.paodeacucar.com/produto/383136/azeite-portugues-de-oliva-extra-virgem-parus-vidro-500ml,Pão de Açúcar
Azeite de Oliva Extra Virgem Turca Kristal Vidro 500ml,44.99,https://www.paodeacucar.com/produto/1245453/azeite-de-oliva-extra-virgem-turca-kristal-vidro-500ml,Pão de Açúcar
Azeite de Oliva Italiano Extra Virgem COSTA D'ORO 500ml,55.9,https://www.paodeacucar.com/produto/675/azeite-de-oliva-italiano-extra-virgem-costa-doro-500ml,Pão de Açúcar
Azeite de Oliva Extra Virgem Português Gallo Ancestral Gourmet Vidro 400ml,59.9,https://www.paodeacucar.com/produto/807874/azeite-de-oliva-extra-virgem-portugues-gallo-ancestral-gourmet-vidro-400ml,Pão de Açúcar
Azeite Chileno de Oliva Extra Virgem Premium DELEYDA Vidro 500ml,77.9,https://www.paodeacucar.com/produto/290529/azeite-chileno-de-oliva-extra-virgem-premium-deleyda-vidro-500ml,Pão de Açúcar
Azeite de Oliva Extra Virgem Português Herdade do Esporão Vidro 250ml,59.99,https://www.paodeacucar.com/produto/555715/azeite-de-oliva-extra-virgem-portugues-herdade-do-esporao-vidro-250ml,Pão de Açúcar
Azeite de Oliva Extravirgem Rahma 375ml,36.99,https://www.paodeacucar.com/produto/1618735/azeite-de-oliva-extravirgem-rahma-375ml,Pão de Açúcar
Azeite de Oliva Extra Virgem Reserva Português Gallo Vidro 500ml,55.9,https://www.paodeacucar.com/produto/24746/azeite-de-oliva-extra-virgem-reserva-portugues-gallo-vidro-500ml,Pão de Açúcar
Azeite Português de Oliva Extra Virgem ESPORÃO Vidro 500ml,99.99,https://www.paodeacucar.com/produto/67987/azeite-portugues-de-oliva-extra-virgem-esporao-vidro-500ml,Pão de Açúcar
Azeite Português Extra Virgem SERRATA 500ml,48.99,https://www.paodeacucar.com/produto/418133/azeite-portugues-extra-virgem-serrata-500ml,Pão de Açúcar
Azeite Grego de Oliva Extra Virgem APOLLO Vidro 500ml,65.9,https://www.paodeacucar.com/produto/149752/azeite-grego-de-oliva-extra-virgem-apollo-vidro-500ml,Pão de Açúcar
Azeite Ital Ev Coldi Fiori 375ml,36.99,https://www.paodeacucar.com/produto/1626255/azeite-ital-ev-coldi-fiori-375ml,Pão de Açúcar
Azeite Chileno de Oliva Extra Virgem DELEYDA Vidro 500ml,74.9,https://www.paodeacucar.com/produto/290539/azeite-chileno-de-oliva-extra-virgem-deleyda-vidro-500ml,Pão de Açúcar
Azeite De Oliva Grego Extra Virgem COLAVITA 500ml,91.9,https://www.paodeacucar.com/produto/407252/azeite-de-oliva-grego-extra-virgem-colavita-500ml,Pão de Açúcar
Azeite de Oliva Extra Virgem Suave Orgânico Português Andorinha Especiais Vidro 500ml,65.9,https://www.paodeacucar.com/produto/1376190/azeite-de-oliva-extra-virgem-suave-organico-portugues-andorinha-especiais-vidro-500ml,Pão de Açúcar
Azeite de Oliva Extra Virgem Português Frutado Rossio de Abrantes Master Blenders Vidro 500ml,81.9,https://www.paodeacucar.com/produto/1631301/azeite-de-oliva-extra-virgem-portugues-frutado-rossio-de-abrantes-master-blenders-vidro-500ml,Pão de Açúcar
Azeite de Oliva Tipo Único Português Gallo Vidro 250ml,30.54,https://www.paodeacucar.com/produto/451056/azeite-de-oliva-tipo-unico-portugues-gallo-vidro-250ml,Pão de Açúcar
Azeite Extra Virgem Português Herdade do Esporão Seleção 500ml,165.9,https://www.paodeacucar.com/produto/402471/azeite-extra-virgem-portugues-herdade-do-esporao-selecao-500ml,Pão de Açúcar
Azeite Português de Oliva Extra Virgem Vintage ANDORINHA Vidro 500ml,61.9,https://www.paodeacucar.com/produto/156639/azeite-portugues-de-oliva-extra-virgem-vintage-andorinha-vidro-500ml,Pão de Açúcar
Azeite Espanhol de Oliva Virgem BORGES Vidro 500ml,46.99,https://www.paodeacucar.com/produto/5868/azeite-espanhol-de-oliva-virgem-borges-vidro-500ml,Pão de Açúcar
Azeite Italiano de Oliva Extra Virgem OLITALIA Vidro 500ml,62.9,https://www.paodeacucar.com/produto/76940/azeite-italiano-de-oliva-extra-virgem-olitalia-vidro-500ml,Pão de Açúcar
Azeite Italiano de Oliva Extra Virgem COLAVITA Vidro 500ml,91.9,https://www.paodeacucar.com/produto/100438/azeite-italiano-de-oliva-extra-virgem-colavita-vidro-500ml,Pão de Açúcar
Azeite de Oliva Extra Virgem Italiano La Pastina Vidro 500ml,83.9,https://www.paodeacucar.com/produto/505547/azeite-de-oliva-extra-virgem-italiano-la-pastina-vidro-500ml,Pão de Açúcar
Azeite Português de Oliva Extra Virgem Seleção ANDORINHA Vidro 500ml,61.9,https://www.paodeacucar.com/produto/175223/azeite-portugues-de-oliva-extra-virgem-selecao-andorinha-vidro-500ml,Pão de Açúcar
Azeite de Oliva Extra Virgem Chileno Deleyda Fine Selection Vidro 500ml,109.9,https://www.paodeacucar.com/produto/459545/azeite-de-oliva-extra-virgem-chileno-deleyda-fine-selection-vidro-500ml,Pão de Açúcar
Azeite Italiano Trufado COLLITALI Trufa Branca 125ml,105.9,https://www.paodeacucar.com/produto/461331/azeite-italiano-trufado-collitali-trufa-branca-125ml,Pão de Açúcar
Azeite Italiano Trufado MONTOSCO Trufa Branca 125ml,79.9,https://www.paodeacucar.com/produto/461329/azeite-italiano-trufado-montosco-trufa-branca-125ml,Pão de Açúcar
Azeite de Oliva Extra Virgem SANTIAGO 500g,57.9,https://www.paodeacucar.com/produto/327598/azeite-de-oliva-extra-virgem-santiago-500g,Pão de Açúcar
Azeite Oliva Extra Virgem Uruguaio Garzon Trivarietal 500 ml,89.9,https://www.paodeacucar.com/produto/568408/azeite-oliva-extra-virgem-uruguaio-garzon-trivarietal-500-ml,Pão de Açúcar
Azeite Espanhol de Oliva Extra Virgem Marcante Picual BORGES Vidro 500ml,62.9,https://www.paodeacucar.com/produto/7049/azeite-espanhol-de-oliva-extra-virgem-marcante-picual-borges-vidro-500ml,Pão de Açúcar
Azeite de Oliva Extra Virgem Português Andorinha Clássicos Projeto Revoa Vidro 500ml,56.9,https://www.paodeacucar.com/produto/753043/azeite-de-oliva-extra-virgem-portugues-andorinha-classicos-projeto-revoa-vidro-500ml,Pão de Açúcar
Azeite Italiano de Oliva Extra Virgem COSTA D'ORO Il Classico 250ml,36.33,https://www.paodeacucar.com/produto/75560/azeite-italiano-de-oliva-extra-virgem-costa-doro-il-classico-250ml,Pão de Açúcar
Azeite Português de Oliva Extra Virgem PORTUCALE Vidro 500ml,57.9,https://www.paodeacucar.com/produto/1189/azeite-portugues-de-oliva-extra-virgem-portucale-vidro-500ml,Pão de Açúcar
Azeite de Oliva Extra Virgem Picual Orfeu Vidro 250ml,115.9,https://www.paodeacucar.com/produto/1628050/azeite-de-oliva-extra-virgem-picual-orfeu-vidro-250ml,Pão de Açúcar
Azeite de Oliva Extra Virgem Arbequina Orfeu Vidro 250ml,115.9,https://www.paodeacucar.com/produto/1628049/azeite-de-oliva-extra-virgem-arbequina-orfeu-vidro-250ml,Pão de Açúcar
Azeite de Oliva Extra Virgem Português Maduro Rossio de Abrantes Master Blenders Vidro 500ml,81.9,https://www.paodeacucar.com/produto/1631304/azeite-de-oliva-extra-virgem-portugues-maduro-rossio-de-abrantes-master-blenders-vidro-500ml,Pão de Açúcar
Azeite Espanhol de Oliva Extra Virgem BORGES Vidro 250ml,31.84,https://www.paodeacucar.com/produto/37415/azeite-espanhol-de-oliva-extra-virgem-borges-vidro-250ml,Pão de Açúcar
Azeite Extra Virgem Uruguaio Garzon Corte Italiano 500 ml,85.9,https://www.paodeacucar.com/produto/568450/azeite-extra-virgem-uruguaio-garzon-corte-italiano-500-ml,Pão de Açúcar
Azeite de Oliva Extra Virgem Português Verde Rossio de Abrantes Master Blenders Vidro 500ml,81.9,https://www.paodeacucar.com/produto/1631303/azeite-de-oliva-extra-virgem-portugues-verde-rossio-de-abrantes-master-blenders-vidro-500ml,Pão de Açúcar
Azeite Brasileiro Extra Vigem Frutado BATALHA 500ml,82.9,https://www.paodeacucar.com/produto/342257/azeite-brasileiro-extra-vigem-frutado-batalha-500ml,Pão de Açúcar
Azeite Português de Oliva Extra Virgem Galega ESPORÃO Vidro 500ml,125.9,https://www.paodeacucar.com/produto/9747/azeite-portugues-de-oliva-extra-virgem-galega-esporao-vidro-500ml,Pão de Açúcar
Azeite Brasileiro Extra Virgem Intenso BATALHA Vidro 500ml,87.9,https://www.paodeacucar.com/produto/407335/azeite-brasileiro-extra-virgem-intenso-batalha-vidro-500ml,Pão de Açúcar
Azeite de Dendê Cepêra Vidro 100ml,12.79,https://www.paodeacucar.com/produto/182043/azeite-de-dende-cepera-vidro-100ml,Pão de Açúcar
Azeite Italiano de Oliva Extra Virgem COLAVITA Vidro 250ml,59.73,https://www.paodeacucar.com/produto/129600/azeite-italiano-de-oliva-extra-virgem-colavita-vidro-250ml,Pão de Açúcar
Azeite Oliva Extra Virgem Uruguaio Garzon Bivarietal 500 ml,99.9,https://www.paodeacucar.com/produto/568449/azeite-oliva-extra-virgem-uruguaio-garzon-bivarietal-500-ml,Pão de Açúcar
Azeite Espanhol de Oliva Extra Virgem Frutado BORGES Vidro 500ml,62.9,https://www.paodeacucar.com/produto/6587/azeite-espanhol-de-oliva-extra-virgem-frutado-borges-vidro-500ml,Pão de Açúcar
Azeite de Oliva Borges Extra Virgem Orgânico Vidro 500ml,63.9,https://www.paodeacucar.com/produto/13839/azeite-de-oliva-borges-extra-virgem-organico-vidro-500ml,Pão de Açúcar
Azeite Espanhol de Oliva Extra Virgem Equilibrado BORGES Vidro 500ml,62.9,https://www.paodeacucar.com/produto/129901/azeite-espanhol-de-oliva-extra-virgem-equilibrado-borges-vidro-500ml,Pão de Açúcar
Azeite Italiano de Oliva Extra Virgem Basilolio COLAVITA Vidro 250ml,81.9,https://www.paodeacucar.com/produto/132516/azeite-italiano-de-oliva-extra-virgem-basilolio-colavita-vidro-250ml,Pão de Açúcar
Azeite Italiano de Oliva Extra Virgem Tartufolio COLAVITA Vidro 250ml,109.9,https://www.paodeacucar.com/produto/46406/azeite-italiano-de-oliva-extra-virgem-tartufolio-colavita-vidro-250ml,Pão de Açúcar
Azeite Extra Virgem Paganini 500ml,105.9,https://www.paodeacucar.com/produto/459529/azeite-extra-virgem-paganini-500ml,Pão de Açúcar
Azeite de Oliva Extra Virgem Koroneiki Orfeu Vidro 250ml,115.9,https://www.paodeacucar.com/produto/1628052/azeite-de-oliva-extra-virgem-koroneiki-orfeu-vidro-250ml,Pão de Açúcar
Azeite de Oliva Filippo Berio Extra Virgem 250mL,32.49,https://www.paodeacucar.com/produto/1407884/azeite-de-oliva-filippo-berio-extra-virgem-250ml,Pão de Açúcar
Azeite Portugal Portucale Orgânico Extra Virgem 500ml,62.9,https://www.paodeacucar.com/produto/1404587/azeite-portugal-portucale-organico-extra-virgem-500ml,Pão de Açúcar
Azeite Português de Oliva Extra Virgem Cordovil ESPORÃO Vidro 500ml,125.9,https://www.paodeacucar.com/produto/1191/azeite-portugues-de-oliva-extra-virgem-cordovil-esporao-vidro-500ml,Pão de Açúcar
Azeite Extra Virgem Argentino Familia Zuccardi Picual 500ml,99.9,https://www.paodeacucar.com/produto/752467/azeite-extra-virgem-argentino-familia-zuccardi-picual-500ml,Pão de Açúcar
Azeite de Oliva Extra Virgem Português Esporão Cobrançosa 500ml,119.9,https://www.paodeacucar.com/produto/1626367/azeite-de-oliva-extra-virgem-portugues-esporao-cobrancosa-500ml,Pão de Açúcar
Azeite de Oliva Extra Virgem Arbosana Orfeu Vidro 250ml,115.9,https://www.paodeacucar.com/produto/1628051/azeite-de-oliva-extra-virgem-arbosana-orfeu-vidro-250ml,Pão de Açúcar
Azeite Italiano de Oliva Extra Virgem Colavita 250ml,85.9,https://www.paodeacucar.com/produto/132932/azeite-italiano-de-oliva-extra-virgem-colavita-250ml,Pão de Açúcar
Azeite Andorinha Extra Virgem Olivia Pack 225ml,79.9,https://www.paodeacucar.com/produto/1629037/azeite-andorinha-extra-virgem-olivia-pack-225ml,Pão de Açúcar
Azeite Extra Virgem Português Quinta do Crasto Seleção 500ml,115.9,https://www.paodeacucar.com/produto/459528/azeite-extra-virgem-portugues-quinta-do-crasto-selecao-500ml,Pão de Açúcar
Azeite Orfeu Blend da Safra 350ml,225.9,https://www.paodeacucar.com/produto/471822/azeite-orfeu-blend-da-safra-350ml,Pão de Açúcar
Azeite Extra Virgem Argentino Familia Zuccardi Coratina 250ml,68.9,https://www.paodeacucar.com/produto/619853/azeite-extra-virgem-argentino-familia-zuccardi-coratina-250ml,Pão de Açúcar
Azeite de Oliva Extra Virgem Intenso Brasileiro Batalha Vidro 250ml,57.13,https://www.paodeacucar.com/produto/1130984/azeite-de-oliva-extra-virgem-intenso-brasileiro-batalha-vidro-250ml,Pão de Açúcar
Azeite Italiano Extra Virgem COLAVITA Decanter Vidro 250ml,88.9,https://www.paodeacucar.com/produto/169156/azeite-italiano-extra-virgem-colavita-decanter-vidro-250ml,Pão de Açúcar
Condimento de Azeite de Oliva com Molho Shoyu e Gengibre Borges Garrafa 200ml,51.9,https://www.paodeacucar.com/produto/146315/condimento-de-azeite-de-oliva-com-molho-shoyu-e-gengibre-borges-garrafa-200ml,Pão de Açúcar
Óleo de Soja LIZA Pet 900ml,8.09,https://www.paodeacucar.com/produto/131661/oleo-de-soja-liza-pet-900ml,Pão de Açúcar
Óleo de Soja Tipo 1 Qualitá Garrafa 900ml,7.99,https://www.paodeacucar.com/produto/30450/oleo-de-soja-tipo-1-qualita-garrafa-900ml,Pão de Açúcar
Óleo de Girassol Tipo 1 Liza Especiais Garrafa 900ml,18.79,https://www.paodeacucar.com/produto/7614/oleo-de-girassol-tipo-1-liza-especiais-garrafa-900ml,Pão de Açúcar
Óleo De Soja SOYA Garrafa 900ml,7.99,https://www.paodeacucar.com/produto/124153/oleo-de-soja-soya-garrafa-900ml,Pão de Açúcar
Oléo de Canola QUALITÁ Pet 900ml,14.99,https://www.paodeacucar.com/produto/31013/oleo-de-canola-qualita-pet-900ml,Pão de Açúcar
Bacalhau em Azeite com Alho Ramirez Caixa 72g,19.99,https://www.paodeacucar.com/produto/117174/bacalhau-em-azeite-com-alho-ramirez-caixa-72g,Pão de Açúcar
Óleo de Milho LIZA Pet 900ml,17.99,https://www.paodeacucar.com/produto/4446/oleo-de-milho-liza-pet-900ml,Pão de Açúcar
Torrada com Azeite e Orégano CASA VICTORIANA 150g,19.9,https://www.paodeacucar.com/produto/74840/torrada-com-azeite-e-oregano-casa-victoriana-150g,Pão de Açúcar
Óleo de Girassol QUALITÁ Pet 900ml,13.99,https://www.paodeacucar.com/produto/30573/oleo-de-girassol-qualita-pet-900ml,Pão de Açúcar
Filé de Atum em Pedaços em Azeite de Oliva Gomes da Costa Caixa 84g,20.49,https://www.paodeacucar.com/produto/145484/file-de-atum-em-pedacos-em-azeite-de-oliva-gomes-da-costa-caixa-84g,Pão de Açúcar
Filé de Sardinha em Azeite com Azeitonas Ramirez Caixa 70g,14.49,https://www.paodeacucar.com/produto/302162/file-de-sardinha-em-azeite-com-azeitonas-ramirez-caixa-70g,Pão de Açúcar
Molho de Pimenta com Azeite Original Gallo Vidro 50ml,18.79,https://www.paodeacucar.com/produto/315841/molho-de-pimenta-com-azeite-original-gallo-vidro-50ml,Pão de Açúcar
Pão de Forma Alecrim e Azeite Panco Artesanale Pacote 350g,10.29,https://www.paodeacucar.com/produto/1629357/pao-de-forma-alecrim-e-azeite-panco-artesanale-pacote-350g,Pão de Açúcar
Massa Instantânea Legumes com Azeite Nissin Cup Noodles Copo 67g,2.99,https://www.paodeacucar.com/produto/433156/massa-instantanea-legumes-com-azeite-nissin-cup-noodles-copo-67g,Pão de Açúcar
Atum Sólido em Azeite de Oliva Tours 255g,36.49,https://www.paodeacucar.com/produto/718703/atum-solido-em-azeite-de-oliva-tours-255g,Pão de Açúcar
Torrada Italiana Azeite & Alho Viterale Gourmet Pacote 100g,18.5,https://www.paodeacucar.com/produto/542979/torrada-italiana-azeite---alho-viterale-gourmet-pacote-100g,Pão de Açúcar
Crostata Italiana Azeite & Alho Viterale Gourmet Pacote 165g,18.5,https://www.paodeacucar.com/produto/542978/crostata-italiana-azeite---alho-viterale-gourmet-pacote-165g,Pão de Açúcar
Torrada Italiana Azeite & Orégano Viterale Gourmet Pacote 100g,18.5,https://www.paodeacucar.com/produto/542982/torrada-italiana-azeite---oregano-viterale-gourmet-pacote-100g,Pão de Açúcar
Óleo Composto Maria Tradicional PET 500ml,14.49,https://www.paodeacucar.com/produto/309481/oleo-composto-maria-tradicional-pet-500ml,Pão de Açúcar
Filé de Atum em Azeite de Oliva com Jalapeño Gomes da Costa Vidro Peso Líquido 180g,57.9,https://www.paodeacucar.com/produto/1556039/file-de-atum-em-azeite-de-oliva-com-jalapeno-gomes-da-costa-vidro-peso-liquido-180g,Pão de Açúcar
Óleo de Soja Vitaliv Garrafa 900ml,7.99,https://www.paodeacucar.com/produto/1625375/oleo-de-soja-vitaliv-garrafa-900ml,Pão de Açúcar
Filé de Atum em Pedaços em Azeite de Oliva com Alho Gomes da Costa Caixa 84g,20.49,https://www.paodeacucar.com/produto/146266/file-de-atum-em-pedacos-em-azeite-de-oliva-com-alho-gomes-da-costa-caixa-84g,Pão de Açúcar
Óleo de Milho QUALITÁ Pet 900ml,14.99,https://www.paodeacucar.com/produto/30791/oleo-de-milho-qualita-pet-900ml,Pão de Açúcar
Salada De Atum Com Batata Doce E Azeite GOMES DA COSTA Pote 150g,11.49,https://www.paodeacucar.com/produto/328298/salada-de-atum-com-batata-doce-e-azeite-gomes-da-costa-pote-150g,Pão de Açúcar
Chips de Batata-Doce Azeite e Manjericão Roots To Go Pacote 45g,9.69,https://www.paodeacucar.com/produto/477926/chips-de-batata-doce-azeite-e-manjericao-roots-to-go-pacote-45g,Pão de Açúcar
Molho de Pimenta Extraforte com Azeite Gallo Vidro 50ml,18.79,https://www.paodeacucar.com/produto/456674/molho-de-pimenta-extraforte-com-azeite-gallo-vidro-50ml,Pão de Açúcar
Queijo de Cabra no Azeite & Ervas Tipo Boursin D'FARM 250g,47.9,https://www.paodeacucar.com/produto/413013/queijo-de-cabra-no-azeite---ervas-tipo-boursin-dfarm-250g,Pão de Açúcar
Pipoca do Johnny Parmesão Azeite Trufado 40g,10.99,https://www.paodeacucar.com/produto/1616689/pipoca-do-johnny-parmesao-azeite-trufado-40g,Pão de Açúcar
Óleo de Soja COCAMAR Pet 900ml,7.99,https://www.paodeacucar.com/produto/180915/oleo-de-soja-cocamar-pet-900ml,Pão de Açúcar
Óleo de Coco sem Sabor TAEQ Vidro 500ml,34.99,https://www.paodeacucar.com/produto/426618/oleo-de-coco-sem-sabor-taeq-vidro-500ml,Pão de Açúcar
Óleo de Milho SALADA Pet 900ml,15.99,https://www.paodeacucar.com/produto/5474/oleo-de-milho-salada-pet-900ml,Pão de Açúcar
Óleo Composto de Soja e Oliva Manteiga Maria Garrafa 500ml,15.49,https://www.paodeacucar.com/produto/1245448/oleo-composto-de-soja-e-oliva-manteiga-maria-garrafa-500ml,Pão de Açúcar
Óleo de Algodão Tipo 1 Liza Especiais Garrafa 900ml,14.99,https://www.paodeacucar.com/produto/806488/oleo-de-algodao-tipo-1-liza-especiais-garrafa-900ml,Pão de Açúcar
Óleo Composto de Milho e Canola Baunilha Liza Especiais Garrafa 500ml,9.99,https://www.paodeacucar.com/produto/1624654/oleo-composto-de-milho-e-canola-baunilha-liza-especiais-garrafa-500ml,Pão de Açúcar
Oleo de Coco COPRA sem Sabor 500ml,45.99,https://www.paodeacucar.com/produto/396848/oleo-de-coco-copra-sem-sabor-500ml,Pão de Açúcar
Óleo De Coco COPRA Sem Sabor Vidro 200ml,24.99,https://www.paodeacucar.com/produto/428193/oleo-de-coco-copra-sem-sabor-vidro-200ml,Pão de Açúcar
Óleo de Coco Extra Virgem Sachê Copra 100ml,15.99,https://www.paodeacucar.com/produto/466749/oleo-de-coco-extra-virgem-sache-copra-100ml,Pão de Açúcar
Óleo Composto de Soja e Oliva Defumado Qualitá Garrafa 500ml,12.79,https://www.paodeacucar.com/produto/430150/oleo-composto-de-soja-e-oliva-defumado-qualita-garrafa-500ml,Pão de Açúcar
Óleo Composto de Milho e Algodão Liza Especiais Garrafa 500ml,9.99,https://www.paodeacucar.com/produto/1624653/oleo-composto-de-milho-e-algodao-liza-especiais-garrafa-500ml,Pão de Açúcar
Óleo de Coco Spray sem Sabor Copra Frasco 100ml,28.99,https://www.paodeacucar.com/produto/749601/oleo-de-coco-spray-sem-sabor-copra-frasco-100ml,Pão de Açúcar
Óleo Coco Purilev Vidro Sem Sabor - 500Ml,33.99,https://www.paodeacucar.com/produto/802574/oleo-coco-purilev-vidro-sem-sabor---500ml,Pão de Açúcar
Óleo de Coco Extra Virgem Taeq Vidro 200ml,17.79,https://www.paodeacucar.com/produto/1629236/oleo-de-coco-extra-virgem-taeq-vidro-200ml,Pão de Açúcar
Óleo de Coco Extra Virgem Taeq Vidro 500ml,37.29,https://www.paodeacucar.com/produto/1629237/oleo-de-coco-extra-virgem-taeq-vidro-500ml,Pão de Açúcar
Óleo de Coco Extra Virgem Taeq Frasco 125ml Spray,18.49,https://www.paodeacucar.com/produto/1627520/oleo-de-coco-extra-virgem-taeq-frasco-125ml-spray,Pão de Açúcar
Manteiga de Coco com Sal COPRA Pote 200g,24.99,https://www.paodeacucar.com/produto/1614050/manteiga-de-coco-com-sal-copra-pote-200g,Pão de Açúcar
Desmoldante Unta Formas Qualitá Lata 125ml Spray,17.79,https://www.paodeacucar.com/produto/1631154/desmoldante-unta-formas-qualita-lata-125ml-spray,Pão de Açúcar
Desmoldante Aerossol de Coco Yes Foods Premium Frasco 170ml Spray,30.49,https://www.paodeacucar.com/produto/1626627/desmoldante-aerossol-de-coco-yes-foods-premium-frasco-170ml-spray,Pão de Açúcar
Desmoldante Aerossol de Avocado Yes Foods Premium Frasco 170ml Spray,30.49,https://www.paodeacucar.com/produto/1626637/desmoldante-aerossol-de-avocado-yes-foods-premium-frasco-170ml-spray,Pão de Açúcar
Desmoldante Aerossol de Oliva Yes Foods Premium Frasco 170ml Spray,30.49,https://www.paodeacucar.com/produto/1626638/desmoldante-aerossol-de-oliva-yes-foods-premium-frasco-170ml-spray,Pão de Açúcar
Azeite de Oliva Extra Virgem Português com Bico Dosador Qualitá Vidro 500ml,36.99,https://www.paodeacucar.com/produto/87786/azeite-de-oliva-extra-virgem-portugues-com-bico-dosador-qualita-vidro-500ml,Pão de Açúcar
Azeite de Oliva Extra Virgem Espanhol com Bico Dosador Qualitá Vidro 500ml,48.49,https://www.paodeacucar.com/produto/104889/azeite-de-oliva-extra-virgem-espanhol-com-bico-dosador-qualita-vidro-500ml,Pão de Açúcar
Azeite Extra Virgem QUALITÁ 500ml,49.49,https://www.paodeacucar.com/produto/446692/azeite-extra-virgem-qualita-500ml,Pão de Açúcar
Azeite de Oliva Extra Virgem Spray Português Andorinha Clássicos Frasco 200ml,40.49,https://www.paodeacucar.com/produto/312139/azeite-de-oliva-extra-virgem-spray-portugues-andorinha-classicos-frasco-200ml,Pão de Açúcar
Azeite Espanhol de Oliva Extra Virgem CARBONELL Vidro 500ml,52.9,https://www.paodeacucar.com/produto/132296/azeite-espanhol-de-oliva-extra-virgem-carbonell-vidro-500ml,Pão de Açúcar
Azeite O-live Extra Virgem Organico 450ml,49.99,https://www.paodeacucar.com/produto/1627255/azeite-o-live-extra-virgem-organico-450ml,Pão de Açúcar
Azeite Português de Oliva Extra Virgem TEJO Vidro 500ml,44.99,https://www.paodeacucar.com/produto/281882/azeite-portugues-de-oliva-extra-virgem-tejo-vidro-500ml,Pão de Açúcar
Azeite Espanhol de Oliva CARBONELL Vidro 500ml,50.25,https://www.paodeacucar.com/produto/97117/azeite-espanhol-de-oliva-carbonell-vidro-500ml,Pão de Açúcar
Azeite de Oliva Extravirgem CRUDO  500ml,125.9,https://www.paodeacucar.com/produto/200215/azeite-de-oliva-extravirgem-crudo--500ml,Pão de Açúcar
Azeite de Oliva com Manjericão Espanhol Borges Ferran Adrià Vidro 200ml,51.9,https://www.paodeacucar.com/produto/45601/azeite-de-oliva-com-manjericao-espanhol-borges-ferran-adria-vidro-200ml,Pão de Açúcar
Azeite de Oliva Extra Virgem Frutado FILIPPO BERIO Vidro 500ml,52.9,https://www.paodeacucar.com/produto/450252/azeite-de-oliva-extra-virgem-frutado-filippo-berio-vidro-500ml,Pão de Açúcar
Azeite Português de Oliva Extra Virgem Seleção Premium PORTUCALE Vidro 500ml,67.9,https://www.paodeacucar.com/produto/233558/azeite-portugues-de-oliva-extra-virgem-selecao-premium-portucale-vidro-500ml,Pão de Açúcar
Azeite com Trufa Filippo Berio 250ml,105.9,https://www.paodeacucar.com/produto/475020/azeite-com-trufa-filippo-berio-250ml,Pão de Açúcar
Azeite Extra Virgem Argentino Familia Zuccardi Arauco 250ml,76.9,https://www.paodeacucar.com/produto/619856/azeite-extra-virgem-argentino-familia-zuccardi-arauco-250ml,Pão de Açúcar
Azeite de Oliva Extra Virgem Argentino Genovesa Familia Zuccardi Vidro 250ml,73.9,https://www.paodeacucar.com/produto/1625641/azeite-de-oliva-extra-virgem-argentino-genovesa-familia-zuccardi-vidro-250ml,Pão de Açúcar
Azeite Grego QUALITÁ 500ml,55.9,https://www.paodeacucar.com/produto/446691/azeite-grego-qualita-500ml,Pão de Açúcar
